{
  "format_version": 2,
  "id": "four-way-north-east-devices",
  "name": "Four-way intersection — North to east experiment · physical devices",
  "description": "Synthetic Transformer Routes experiment: 900 north-entry departures/hour with 96% selecting the east exit, all day; other entries request 30/hour each.",
  "network": {
    "file": "network.net.xml",
    "attribution": "Synthetic STREETFLOW four-way intersection"
  },
  "terminals_file": "terminals.json",
  "journey_model_file": "journey-model.json",
  "defaults": {
    "start_time_seconds": 27000,
    "step_seconds": 0.5
  },
  "traffic_lights_file": "traffic-lights.json"
}
